{
  "$schema": "http://json-schema.org/draft-07/schema#",
  "title": "FactorIA AI config (~/.factoria/ai.json)",
  "description": "User-level AI configuration: providers (API keys or CLI agents), the roles (orchestrator, worker, fast, artist, audio, artCritic, reviewer), the asset providers that generate images, sounds and 3D models, and the websites the AI should search for assets. Lives in the user's home, NEVER inside a game project.",
  "type": "object",
  "properties": {
    "$schema": { "type": "string" },
    "defaultProvider": {
      "type": "string",
      "description": "Provider used by roles that do not set one. Default: anthropic."
    },
    "providers": {
      "type": "object",
      "description": "Providers by name. Built-in names (anthropic, openai, openrouter, gemini, groq, deepseek, ollama, lmstudio, claude-code, codex, elevenlabs, meshy, fake) exist without being listed; listing one overrides its fields.",
      "additionalProperties": { "$ref": "#/$defs/provider" }
    },
    "assets": {
      "type": "object",
      "description": "Which provider generates each kind of asset for the assets.generate_* commands. There is no default (generation costs money): a kind that is not listed makes its command fail with the JSON to add. The `fake` provider generates placeholders offline for free. Example: {\"image\": {\"provider\": \"openai\", \"model\": \"gpt-image-1\"}, \"sound\": {\"provider\": \"elevenlabs\"}, \"voice\": {\"provider\": \"elevenlabs\", \"voice\": \"<voice id>\"}, \"model3d\": {\"provider\": \"meshy\"}}.",
      "properties": {
        "image": { "$ref": "#/$defs/assetRoute" },
        "sound": { "$ref": "#/$defs/assetRoute" },
        "music": { "$ref": "#/$defs/assetRoute" },
        "voice": { "$ref": "#/$defs/assetRoute" },
        "model3d": { "$ref": "#/$defs/assetRoute" }
      },
      "additionalProperties": false
    },
    "assetSources": {
      "type": "object",
      "description": "Websites the AI should look at when it searches for assets (images, 3D models, audio, fonts...), instead of searching the whole internet. Each category is a list of sites: a plain domain or address (\"opengameart.org\"), or an object with an optional note. The editor's AI settings window (AI Assistant > AI settings...) edits this section. With no sites the AI searches the internet as it wishes. Example: {\"images\": [{\"url\": \"https://opengameart.org\", \"note\": \"CC0 packs\"}], \"models\": [\"kenney.nl\"], \"onlyListed\": true}.",
      "properties": {
        "images": { "$ref": "#/$defs/siteList", "description": "Images and textures." },
        "models": { "$ref": "#/$defs/siteList", "description": "3D models." },
        "audio": { "$ref": "#/$defs/siteList", "description": "Sound effects and music." },
        "fonts": { "$ref": "#/$defs/siteList", "description": "Fonts." },
        "other": { "$ref": "#/$defs/siteList", "description": "Anything else the AI may need (tilesets, icon packs, shaders...)." },
        "onlyListed": { "type": "boolean", "default": false, "description": "false: the AI looks at these sites first and may also search the internet. true: the AI uses ONLY these sites for assets (no general web search, no other site). The rule goes into the prompt of every role; Claude Code is also started with WebSearch switched off and WebFetch allowed for these domains only. See docs/AI_PROVIDERS.md, \"Asset sources\"." }
      },
      "additionalProperties": false
    },
    "roles": {
      "type": "object",
      "description": "Which provider/model plays each role. orchestrator plans and delegates, worker implements, fast does small mechanical tasks, artist makes the game's art, audio makes its sound and music, artCritic and reviewer (read-only) give opinions on the art and on the whole game when the user asks for a review. A role that is not listed gets a default that follows the provider and model of orchestrator (artist, artCritic, reviewer) or worker (audio), so an ai.json written before these roles existed keeps working on the same provider.",
      "properties": {
        "orchestrator": { "$ref": "#/$defs/role" },
        "worker": { "$ref": "#/$defs/role" },
        "fast": { "$ref": "#/$defs/role" },
        "artist": { "$ref": "#/$defs/role" },
        "audio": { "$ref": "#/$defs/role" },
        "artCritic": { "$ref": "#/$defs/role" },
        "reviewer": { "$ref": "#/$defs/role" }
      },
      "additionalProperties": false
    },
    "limits": {
      "type": "object",
      "description": "Safety limits for one agent run.",
      "properties": {
        "maxTurns": { "type": "integer", "minimum": 1, "default": 40 },
        "maxCostUsd": { "type": "number", "minimum": 0, "description": "0 = unlimited." },
        "maxTotalTokens": { "type": "integer", "minimum": 0, "description": "0 = unlimited." },
        "stuckAfterSeconds": { "type": "integer", "minimum": 0, "default": 180, "description": "The editor's AI panel warns that the agent may be stuck after this many seconds without any sign of activity (an event from the agent or a sub-agent), and offers Stop and Check activity. 0 = never warn." },
        "maxConcurrentRuns": { "type": "integer", "minimum": 1, "default": 3, "description": "How many AI chats the editor lets run at the same time (1 to 8; a value outside that range is brought into it with a warning). Each chat has its own agent, progress, usage and Stop; the plan limits of a provider are shared by all of them." }
      },
      "additionalProperties": false
    }
  },
  "additionalProperties": false,
  "$defs": {
    "siteList": {
      "type": "array",
      "items": {
        "oneOf": [
          { "type": "string", "minLength": 1, "description": "A domain or a web address: opengameart.org, https://kenney.nl/assets." },
          {
            "type": "object",
            "required": ["url"],
            "properties": {
              "url": { "type": "string", "minLength": 1, "description": "A domain or a web address: opengameart.org, https://kenney.nl/assets, github.com/KhronosGroup. No spaces." },
              "note": { "type": "string", "description": "What the site is good for or its license (\"CC0 packs\"); shown to the AI." }
            },
            "additionalProperties": false
          }
        ]
      }
    },
    "assetRoute": {
      "type": "object",
      "required": ["provider"],
      "properties": {
        "provider": { "type": "string", "description": "Name of a provider that can make this kind: image: openai (or an openai-compatible server), fake, asset-command. sound and music: elevenlabs, fake, asset-command. voice: openai, elevenlabs, fake, asset-command. model3d: meshy, fake, asset-command." },
        "model": { "type": "string", "description": "Model of the provider (\"gpt-image-1\", \"eleven_text_to_sound_v2\"...). Empty: the provider's default for the kind." },
        "voice": { "type": "string", "description": "voice only: the voice to speak with (an ElevenLabs voice id, an OpenAI voice name such as \"alloy\")." }
      },
      "additionalProperties": false
    },
    "role": {
      "type": "object",
      "properties": {
        "provider": { "type": "string", "description": "Name of an entry in providers (or a built-in)." },
        "model": { "type": "string", "description": "Model id, e.g. claude-sonnet-5-5." },
        "effort": { "type": "string", "enum": ["low", "medium", "high", "xhigh", "max"] },
        "enabled": {
          "type": "boolean",
          "default": true,
          "description": "false turns the role off: the orchestrator does that work itself (worker, fast, artist, audio), or a review runs on the orchestrator's provider and model (artCritic, reviewer). The orchestrator cannot be turned off (an error). The editor's Roles window has an Enabled checkbox for it."
        },
        "maxTokens": { "type": "integer", "minimum": 1 },
        "maxContextTokens": {
          "type": "integer",
          "minimum": 100000,
          "description": "Most context a session keeps, in tokens (e.g. 400000 on a 1M model). Past it the earlier turns are summarized. Claude Code and the anthropic provider honour it; other providers ignore it. Omit for the model's whole window."
        }
      },
      "additionalProperties": false
    },
    "provider": {
      "type": "object",
      "properties": {
        "type": {
          "type": "string",
          "enum": ["anthropic", "openai-compatible", "claude-code", "codex", "generic-cli", "elevenlabs", "meshy", "fake", "asset-command"],
          "description": "elevenlabs, meshy, fake and asset-command only generate assets (see `assets`); they cannot play a role."
        },
        "preset": {
          "type": "string",
          "enum": ["openai", "openrouter", "gemini", "groq", "deepseek", "ollama", "lmstudio"],
          "description": "openai-compatible only: fills baseUrl and apiKeyEnv."
        },
        "baseUrl": { "type": "string", "description": "API base URL (openai-compatible: without /chat/completions)." },
        "apiKeyEnv": { "type": "string", "description": "Name of the environment variable that holds the key." },
        "apiKey": { "type": "string", "description": "The key itself. Prefer apiKeyEnv. Only honoured in this user-level file." },
        "headers": { "type": "object", "additionalProperties": { "type": "string" } },
        "defaultModel": { "type": "string" },
        "useAntCli": { "type": "boolean", "default": true, "description": "anthropic: fall back to `ant auth print-credentials` when no key is set." },
        "sendReasoningEffort": { "type": "boolean", "default": false, "description": "openai-compatible: send reasoning_effort (low|medium|high) from the role effort." },
        "command": { "type": "string", "description": "CLI agents and asset-command: executable name or path." },
        "argv": {
          "type": "array",
          "items": { "type": "string" },
          "description": "CLI agents: argv template after the command. asset-command uses {prompt} {output} {width} {height} {seconds} {kind} {model} {seed} instead: the program writes the asset to {output} (.png for images, .wav for sounds, music and voice, .glb for models). Placeholders of CLI agents: {prompt} {model} {project} {mcp_config} {session} {project_json} {factoria_json}. {session} is the CLI session id of the conversation (an argument whose placeholder is empty, like the first message's {session}, is dropped together with a bare flag before it). Without {prompt} the prompt is sent on standard input; with `--input-format stream-json` it is one JSON user message that can carry images."
        },
        "env": { "type": "object", "additionalProperties": { "type": "string" } },
        "unsetEnv": { "type": "array", "items": { "type": "string" } },
        "factoriaCommand": { "type": "string", "description": "Command that starts FactorIA for the MCP server. Default: factoria." },
        "license": { "type": "string", "description": "Asset providers: the license or terms note recorded in assets.json for every asset this provider generates (e.g. \"Commercial use under our ElevenLabs Creator plan\"). Default: a note that says where the provider's terms are." },
        "pricing": {
          "type": "object",
          "description": "USD per 1M tokens, for cost estimates of non-Claude models.",
          "properties": {
            "inputPerMTok": { "type": "number", "minimum": 0 },
            "outputPerMTok": { "type": "number", "minimum": 0 },
            "cacheReadPerMTok": { "type": "number", "minimum": 0 },
            "cacheWritePerMTok": { "type": "number", "minimum": 0 }
          },
          "additionalProperties": false
        },
        "maxRetries": { "type": "integer", "minimum": 0, "maximum": 10, "default": 5 },
        "timeoutSeconds": { "type": "number", "minimum": 1 }
      },
      "additionalProperties": false
    }
  }
}
